date,time,id_str,text,user_friends_count,user_location,user_followers_count,user_screen_name,user_verified,coordinates,retweet_count
2018/1/6,0:46,949441912230031361,"President Trump asked Congress for $18 billion for a border wall. In exchange, he offered to protect young undocume… https://t.co/6NbLrdkxSt",886,41003697,New York City,nytimes,True,,893
2018/1/6,0:32,949438388381343745,"It could feel as cold as 100° below zero atop a mountain in New Hampshire. So, there's that. https://t.co/hRWFXudmqQ",886,41003697,New York City,nytimes,True,,469
2018/1/6,0:17,949434617974714369,RT @motokorich: Japanese officials are trying to save lives and stop suicides in the Sea of Trees. Logan Paul isn’t helping.  https://t.co/…,886,41003697,New York City,nytimes,True,,462
2018/1/6,0:2,949430826248409088,New Jersey is now the last state in the nation where drivers are not allowed to pump their own gasoline https://t.co/yTLPsaFJbv,886,41003697,New York City,nytimes,True,,1454
2018/1/5,23:47,949427066088411136,Evening Briefing: Here's what you need to know at the end of the day https://t.co/DtNqbuJ0TQ,886,41003697,New York City,nytimes,True,,74
2018/1/5,23:32,949423275930681347,In search of a good night's sleep: can a simple supplement help? https://t.co/wrT5fLzg5d,886,41003697,New York City,nytimes,True,,70
2018/1/5,23:17,949419499819847683,"Some landlords avoid raising the rent when they have a good tenant. ""My unwritten rule is: You don’t bother me, I d… https://t.co/Bwdkcj1hUd",886,41003697,New York City,nytimes,True,,181
2018/1/5,23:2,949415724816138241,Romaine lettuce is linked to deadly E. coli outbreaks in Canada. American officials are still investigating the cau… https://t.co/IlduOnggrS,886,41003697,New York City,nytimes,True,,303
2018/1/5,22:52,949413220787376128,"Chris Christie on his time as New Jersey's governor: ""I feel like I've done the job as well or better than anybody… https://t.co/bRl06bJXk7",886,41003697,New York City,nytimes,True,,57
2018/1/5,22:42,949410700845371394,"RT @peterbakernyt: In a way, what is shocking about the Wolff book is that its depiction of a capricious, uninformed and erratic president…",886,41003697,New York City,nytimes,True,,576
2018/1/5,22:30,949407762714415104,Arthur Mitchell's proudest accomplishment? Starting Dance Theater of Harlem. “I actually bucked society and an art… https://t.co/1o7UMBSlXO,886,41003697,New York City,nytimes,True,,160
2018/1/5,22:20,949405170089291776,The first known criminal referral has emerged from Congress's Russia inquiries. The target is the author of the Tru… https://t.co/4XblDw1sC4,886,41003697,New York City,nytimes,True,,115
2018/1/5,22:10,949402638218604544,He's an artist who makes fire-breathing robots. Now he wants to make some money. https://t.co/GEnpCjSM69,886,41003697,New York City,nytimes,True,,24
2018/1/5,21:55,949398874896158720,The Golden Globes are Sunday. Here's where to stream some of the nominees. https://t.co/SS5ZPXlkPC,886,41003697,New York City,nytimes,True,,84
2018/1/5,21:40,949395092552540161,This heavenly dish is whipped up from pantry staples https://t.co/KFLltccsDw,886,41003697,New York City,nytimes,True,,71
2018/1/5,21:25,949391312662429699,RT @nytimesbusiness: Too much TV? There were at least 487 original programs that aired in 2017 https://t.co/AoXZhoNEll,886,41003697,New York City,nytimes,True,,22
2018/1/5,21:18,949389603127009280,"The truth has a voice. 

This commercial will premiere Sunday night during the Golden Globes. https://t.co/FziXZxBKmZ",886,41003697,New York City,nytimes,True,,1530
2018/1/5,21:10,949387557938368513,How to make it through winter when you hate winter https://t.co/upUvQBz9FB,886,41003697,New York City,nytimes,True,,118
2018/1/5,21:2,949385556768804868,"""We don't want the forest to be known as a suicide spot. It's dishonorable."" https://t.co/pG2MnjjQkq",886,41003697,New York City,nytimes,True,,94
2018/1/5,20:52,949383016752828416,"Michael Wolff: ""Whether he realized it was an interview or not, I don't know, but it certainly was not off the reco… https://t.co/11azis2gi7",886,41003697,New York City,nytimes,True,,204
2018/1/5,20:42,949380508768768000,"RT @nytopinion: For decades, the United States was a global beacon for those who embraced liberal values. China’s rise is a blunt counterpo…",886,41003697,New York City,nytimes,True,,54
2018/1/5,20:32,949377973404291073,"Greta Gerwig: ""The city felt like my mother. New York City felt like home because it felt like her."" https://t.co/TKTWVsScqm",886,41003697,New York City,nytimes,True,,118
2018/1/5,20:22,949375465877331968,How HQ Trivia became the best worst thing on the internet https://t.co/OMFIp31Tin,886,41003697,New York City,nytimes,True,,46
2018/1/5,20:12,949372941128683521,Most medical advances benefit the living. This one is for the dead. https://t.co/P1jj968xnQ,886,41003697,New York City,nytimes,True,,46
2018/1/5,20:2,949370444116873220,RT @nytimesworld: Can you form a government when many of your leaders are in jail or in exile? Catalonia’s separatists are about to find ou…,886,41003697,New York City,nytimes,True,,161
2018/1/5,19:52,949367927253487616,"New year, new weekly news quiz https://t.co/6FPTtB8877",886,41003697,New York City,nytimes,True,,38
2018/1/5,19:42,949365395240169473,And the 2018 Oscar nominees should be…https://t.co/6Ip7oZ584L,886,41003697,New York City,nytimes,True,,64
2018/1/5,19:32,949362887499403264,Some airlines charge an extra $150 each way for unaccompanied minors to fly. @ronlieber asks why. https://t.co/cEsMcj5XR5,886,41003697,New York City,nytimes,True,,67
2018/1/5,19:22,949360362239021056,"RT @nytvideo: Omar Salinas is one of nearly 200,000 Salvadorans with Temporary Protected Status. He could lose that status this month. Watc…",886,41003697,New York City,nytimes,True,,35
2018/1/5,19:12,949357848282255360,RT @ditzkoff: I wrote about @sethmeyers as he prepares to host a @goldenglobes show for the #MeToo moment and celebrate an entertainment in…,886,41003697,New York City,nytimes,True,,128
2018/1/5,19:2,949355359298351104,"Chris Christie says he has warned President Trump that you can do nothing to make investigations any shorter, but ""… https://t.co/oN6doS4i9p",886,41003697,New York City,nytimes,True,,100
2018/1/5,18:52,949352817839476738,How to react if you get caught in black ice https://t.co/nfuWIFMvrG,886,41003697,New York City,nytimes,True,,100
2018/1/5,18:42,949350297675141121,"Britain is thinking of charging a 25 pence tax for paper coffee cups, hoping to persuade consumers to switch to reu… https://t.co/XqEuhVgyQX",886,41003697,New York City,nytimes,True,,134
2018/1/5,18:34,949348317309390850,"RT @jonathanweisman: A year after Congress launched its investigation into Russian election interference, Judiciary senators have issued th…",886,41003697,New York City,nytimes,True,,1272
2018/1/5,18:31,949347719063244801,Breaking News: The first known criminal referral has emerged from Congress's Russia inquiries. The target is the au… https://t.co/7SUxwvG5Sh,886,41003697,New York City,nytimes,True,,1428
2018/1/5,18:22,949345272609628160,President Trump and Republican leaders in Congress are meeting at Camp David to address an urgent and more conventi… https://t.co/If0eUMY5dB,886,41003697,New York City,nytimes,True,,129
2018/1/5,18:16,949343948786593794,A U.S. citizen who has been held in military custody in Iraq for 4 months has told lawyers with the ACLU that he wa… https://t.co/DzfCvFABpg,886,41003697,New York City,nytimes,True,,184
2018/1/5,18:12,949342762150834176,"XXXTentacion, Kodak Black, Tay-K and 6ix9ine have all been accused of horrible crimes, and they all had hits on the… https://t.co/vAYkKR7YBy",886,41003697,New York City,nytimes,True,,155
2018/1/5,18:2,949340231140102145,"Customs officers at the border and airports searched 60% more cellphones, computers and other electronic devices in… https://t.co/9hCncKc1vy",886,41003697,New York City,nytimes,True,,74
2018/1/5,17:56,949338762278047744,An @nytmag piece on a simple way to prepare kale https://t.co/I6glx0LnSj,886,41003697,New York City,nytimes,True,,44
2018/1/5,17:55,949338482014670849,"Schools in Baltimore don't have heat. Teachers say students have been forced to attend classes bundled up in coats,… https://t.co/7ZdqywuYHA",886,41003697,New York City,nytimes,True,,607
2018/1/5,17:46,949336271700267009,FBI agents are again asking questions about the Clinton Foundation. President Trump has repeatedly urged officials… https://t.co/LxLHKzcZir,886,41003697,New York City,nytimes,True,,408
2018/1/5,17:42,949335207945166854,Every president is confronted by unflattering portrayals by former aides who leave and tell their stories. For Pres… https://t.co/TUwTMgw4CS,886,41003697,New York City,nytimes,True,,338
2018/1/5,17:32,949332684114972672,"Sue Grafton’s private eye heroine, Kinsey Millhone, was a fixture of the best-seller lists. But it took 8 years and… https://t.co/LzyyI86DJL",886,41003697,New York City,nytimes,True,,44
2018/1/5,17:22,949330166035238912,"RT @UpshotNYT: How the new ""association health plans"" will work, and why supporters of Obamacare are worried. https://t.co/cWpZ8knjZl",886,41003697,New York City,nytimes,True,,99
2018/1/5,17:12,949327663210160128,"In post-Weinstein Hollywood, will the Golden Globes rewrite the rules for awards seasons to come?
 https://t.co/QSC0bbaINn",886,41003697,New York City,nytimes,True,,47
2018/1/5,17:2,949325148695523331,What you need to know about security flaws in computer chip — and what you need to do to protect yourself https://t.co/eCLHZNQDPm,886,41003697,New York City,nytimes,True,,112
2018/1/5,16:52,949322630020071424,"It could feel as cold as 100° below zero atop a mountain in New Hampshire. So, there's that. https://t.co/sThy8nLtr3",886,41003697,New York City,nytimes,True,,361
2018/1/5,16:42,949320099164549121,"""When I asked Mary Lois what she first saw in me — a wheelchair-using teenager whose condition was only going to wo… https://t.co/60ZbAZq5UH",886,41003697,New York City,nytimes,True,,47
2018/1/5,16:32,949317594900819968,Confused by the latest news about Russia and the 2016 presidential election? We're here to help. https://t.co/aYR0oz21HG,886,41003697,New York City,nytimes,True,,140
2018/1/5,16:22,949315068629585920,The Norwegian photographer of these puzzling photos is having a moment in Europe's art scene https://t.co/76R7GRyS0R,886,41003697,New York City,nytimes,True,,91
2018/1/5,16:12,949312553347354631,How HQ Trivia became the best worst thing on the internet https://t.co/mAhsGQfOxt,886,41003697,New York City,nytimes,True,,51
2018/1/5,16:2,949310042473484288,California is defiant in the face of the federal government's move to get tough on marijuana https://t.co/4AUIOOsFgz,886,41003697,New York City,nytimes,True,,136
2018/1/5,15:52,949307520425910272,The winter storm that barreled the East Coast has moved on. But the frigid air will linger for days. https://t.co/SJkV9hg8hF,886,41003697,New York City,nytimes,True,,91
2018/1/5,15:42,949305216532393985,"A doctor happened upon the underbelly of the drug treatment industry, where new customers are acquired. So he calle… https://t.co/YDXoxjGTpU",886,41003697,New York City,nytimes,True,,315
2018/1/5,15:30,949302045567275008,Trump's determination to fire Comey led one White House lawyer to take the extraordinary step of misleading the pre… https://t.co/936bV3fY2V,886,41003697,New York City,nytimes,True,,126
2018/1/5,15:25,949300750345228288,"RT @nytvideo: Omar Salinas came to the United States from El Salvador when he was 16. This month, the Trump administration may end the prog…",886,41003697,New York City,nytimes,True,,234
2018/1/5,15:15,949298251852808193,"""It will be very difficult for Sessions to bring us back to a mind-set that existed five years or a decade ago,"" sa… https://t.co/HUhrlNbxAd",886,41003697,New York City,nytimes,True,,145
2018/1/5,15:0,949294540141285377,Morning Briefing: Here's what you need to know to start your day https://t.co/x8EbYuamTe https://t.co/E53vM1PBlA,886,41003697,New York City,nytimes,True,,45
2018/1/5,14:45,949290693381513219,"More than 4,700 people in Britain were stuck in ambulances for more than an hour over Christmas week, as there was… https://t.co/UtYCQGhLPP",886,41003697,New York City,nytimes,True,,130
2018/1/5,14:30,949287100213538817,"Even the most eager consumers of ""fake news"" are reading far more of the real kind, a new study finds https://t.co/wKRK8pyQf7",886,41003697,New York City,nytimes,True,,104
2018/1/5,14:12,949282377515356160,"Michael Wolff: ""Whether he realized it was an interview or not, I don't know, but it certainly was not off the reco… https://t.co/JVrxDcc2cI",886,41003697,New York City,nytimes,True,,256
2018/1/5,14:0,949279461106765825,"Aharon Appelfeld wrote disturbing, obliquely told stories of self-deluded Jews slowly awakening to the reality of t… https://t.co/gdSPNrT3z1",886,41003697,New York City,nytimes,True,,110
2018/1/5,13:45,949275610429476864,"""We don't want the forest to be known as a suicide spot. It's dishonorable."" https://t.co/9X0R2xNiqk",886,41003697,New York City,nytimes,True,,156
2018/1/5,13:37,949273541714894848,"Breaking News: The U.S. added 148,000 jobs last month, as continued growth capped a year of increasing opportunitie… https://t.co/4dawfIirm3",886,41003697,New York City,nytimes,True,,126
2018/1/5,13:29,949271524896362496,Serena Williams announced her withdrawal from the Australian Open https://t.co/pbmTRfs6Sy,886,41003697,New York City,nytimes,True,,57
2018/1/5,13:20,949269314300973056,"Opinion: Publicly, we say #MeToo. Privately, we have misgivings. https://t.co/KmSDYwTzzK",886,41003697,New York City,nytimes,True,,112
2018/1/5,13:11,949266995119378432,Here's what New York City looked like on Instagram during the blizzard: https://t.co/tyd2anEwVz,886,41003697,New York City,nytimes,True,,72
2018/1/5,13:0,949264384647421953,Morning Briefing: Here's what you need to know to start your day https://t.co/ipluxkNaK9 https://t.co/gJVEbibAfn,886,41003697,New York City,nytimes,True,,48
2018/1/5,12:50,949261735583797248,Jeff Sessions and President Trump may find resistance to their pot policy to be much more potent than they anticipa… https://t.co/KpZCwBMW3p,886,41003697,New York City,nytimes,True,,252
2018/1/5,12:41,949259443438530560,The question on the table after the cutoff of U.S. military aid to Pakistan is who will be most disrupted: the Paki… https://t.co/Pzq50MXPfZ,886,41003697,New York City,nytimes,True,,183
2018/1/5,12:29,949256428182802433,Late-night hosts pored over the bombshell accounts of the Trump administration's first year contained in Michael Wo… https://t.co/SBXJAwLkcC,886,41003697,New York City,nytimes,True,,201
2018/1/5,12:15,949252925657944064,Trump's determination to fire Comey led one White House lawyer to take the extraordinary step of misleading the pre… https://t.co/RrtoH50Lrn,886,41003697,New York City,nytimes,True,,210
2018/1/5,12:0,949249216500699136,A closer look at the largest protests in Iran in years suggests that the country’s president may have started it all https://t.co/yvosd3j6OJ,886,41003697,New York City,nytimes,True,,87
2018/1/5,11:44,949245120221728769,"Startled by the hard-sell addicts face, a psychologist discovered the rehab industry’s customer acquisition tricks,… https://t.co/6WA91X9nbi",886,41003697,New York City,nytimes,True,,103
2018/1/5,11:30,949241681253228544,Morning Briefing: Here's what you need to know to start your day https://t.co/g1hQ7vayub https://t.co/tUolMBHZVe,886,41003697,New York City,nytimes,True,,66
2018/1/5,11:15,949237823240105984,"Deadly starfish are feasting on parts of the Great Barrier Reef, which is already threatened by rising ocean temper… https://t.co/brix17Vok1",886,41003697,New York City,nytimes,True,,123
2018/1/5,11:0,949234152439799808,How Michael Wolff went from needling the Manhattan power elite to enraging the leader of the free world https://t.co/cnlLkr27vS,886,41003697,New York City,nytimes,True,,146
2018/1/5,10:44,949230028000292864,Theresa May apologized for delays throughout the health care agency as it scrambled to cope with a particularly dif… https://t.co/O9U3RE0NMe,886,41003697,New York City,nytimes,True,,74
2018/1/5,10:31,949226732254572544,"RT @paulmozur: China's internet is the most censored and surveilled in the world. Yet Chinese are calling for privacy protections. For now,…",886,41003697,New York City,nytimes,True,,116
2018/1/5,10:16,949222969817075712,North Korea accepted the South’s proposal that the two Koreas hold the negotiations at the border village of Panmun… https://t.co/ISq6WbvZLf,886,41003697,New York City,nytimes,True,,158
2018/1/5,10:0,949219011186872320,President Trump's legal team has demanded that Michael Wolff and his publisher halt the release of “Fire and Fury:… https://t.co/iLEbsWfa8i,886,41003697,New York City,nytimes,True,,245
2018/1/5,9:45,949215182538072064,RT @nytimesworld: A suicide bombing claimed by the Islamic State targeted a protest of shopkeepers in Kabul https://t.co/hqRe7bVHNM,886,41003697,New York City,nytimes,True,,40
2018/1/5,9:30,949211455198507009,The Trump administration said it would allow new offshore oil and gas drilling in nearly all United States coastal… https://t.co/pXAas2iibI,886,41003697,New York City,nytimes,True,,180
2018/1/5,9:15,949207606882656261,"RT @RorySmith: Coutinho might be a matter of when, not if, but the real question is why? Barca’s squad is ageing and expensive (though stil…",886,41003697,New York City,nytimes,True,,104
2018/1/5,9:0,949203870315679745,Norway is now selling more electric and hybrid cars than gasoline or diesel ones https://t.co/pgNj8AayWb,886,41003697,New York City,nytimes,True,,438
2018/1/5,8:43,949199568167555072,President Erdogan of Turkey emerged largely unscathed after the U.S. trial of a Turkish banker https://t.co/m0fJbNdNvH,886,41003697,New York City,nytimes,True,,96
2018/1/5,8:29,949196026799448064,"Hurricanes, fires and floods drove global insurance payouts to a record $135 billion last year https://t.co/JiZWMV6bCH",886,41003697,New York City,nytimes,True,,204
2018/1/5,8:14,949192277506908160,“People see Hanyu for the first time and they become hysterical or they’re moved to tears. It’s like their lives ar… https://t.co/51mmi9dTnj,886,41003697,New York City,nytimes,True,,104
2018/1/5,7:59,949188493061906433,"The voter fraud commission arrived with a presidential tweet, and went out with another. Here's how that happened: https://t.co/xbGPmX1yKq",886,41003697,New York City,nytimes,True,,67
2018/1/5,7:45,949185083147214853,A woman challenging Turkey's President Erdogan steps up to run for president https://t.co/y4WXQ5AGx0,886,41003697,New York City,nytimes,True,,433
2018/1/5,7:28,949180793238286336,"RT @NYTStyles: Sneaker Con was overwhelming. Whew. But we broke down tips, tricks and predictions from the experts. https://t.co/AHcGbB8ss9",886,41003697,New York City,nytimes,True,,18
2018/1/5,7:11,949176404398264320,"Opinion: As @miss9afi looks forward to seeing Saudi women drive starting in June, she remembers the female activist… https://t.co/cBNcxqfWE3",886,41003697,New York City,nytimes,True,,333
2018/1/5,6:56,949172637523116032,"RT @nytimesworld: Alberto Fujimori, Peru's former president, was released from a hospital after he was pardoned from a 25-year sentence he…",886,41003697,New York City,nytimes,True,,42
2018/1/5,6:41,949168861655588864,The Norwegian photographer of these puzzling photos is having a moment in Europe's art scene https://t.co/jl9FRhYWID,886,41003697,New York City,nytimes,True,,103
2018/1/5,6:33,949166837509521408,North and South Korea agree to high-level talks on their border amid hopes for a thaw in relations https://t.co/d6OqHG3lB7,886,41003697,New York City,nytimes,True,,138
2018/1/5,6:17,949162821761339392,"RT @dionnesearcey: Another of the Chibok girls has been found. In the nearly four years she's been gone, her parents have fled their homes…",886,41003697,New York City,nytimes,True,,93
2018/1/5,6:2,949159042164785153,California defiant in the face of federal move to get tough on marijuana https://t.co/KMZDwJbw4l,886,41003697,New York City,nytimes,True,,189
2018/1/5,5:47,949155278028591109,"A co-founder of Ripple, a virtual currency, could briefly lay claim to being the world’s fifth richest person, bypa… https://t.co/k6UMiuaMwx",886,41003697,New York City,nytimes,True,,167
2018/1/5,5:32,949151492111413249,HBO confirmed that “Game of Thrones” won’t return for its eighth and final season until 2019 https://t.co/oN9Y0P8aOt,886,41003697,New York City,nytimes,True,,577
2018/1/5,5:17,949147715362963457,Alabama newspaper executive resigns after admitting he once spanked a reporter https://t.co/3LAC5FyCoo,886,41003697,New York City,nytimes,True,,231
2018/1/5,5:2,949143946948591618,"Those iguanas falling from the trees in Florida? They probably aren’t dead, just stunned by the cold. https://t.co/uY0tb7xTbh",886,41003697,New York City,nytimes,True,,407
2018/1/5,4:56,949142416946114560,RT @NYTSports: Marc Stein covered Jordan. Covered Kobe. And LeBron vs. the Warriors. Go behind the NBA curtain every week with @TheSteinLin…,886,41003697,New York City,nytimes,True,,19
2018/1/5,4:48,949140630885691392,President Trump gave firm instructions in March to the White House’s top lawyer: stop Jeff Sessions from recusing h… https://t.co/9EzEDGKp04,886,41003697,New York City,nytimes,True,,313
2018/1/5,4:32,949136410803544069,"""We don’t have to pay for access to publicly owned books, and we shouldn’t have to pay to see art in museums whose… https://t.co/nhA60dQqvX",886,41003697,New York City,nytimes,True,,651
2018/1/5,4:17,949132606498594816,Trump administration plans to delay enforcement of a federal housing rule that requires communities to address patt… https://t.co/EEG3Q6p5kr,886,41003697,New York City,nytimes,True,,608
2018/1/5,4:2,949128833311084544,"In Norway, electric and hybrid cars outsold those running on fossil fuels last year https://t.co/rrhxBWYTGi",886,41003697,New York City,nytimes,True,,618
2018/1/5,3:47,949125068264796161,"RT @grynbaum: Michael Wolff, media piranha in a Charvet tie, has his breakout moment. https://t.co/QrjGDuX0IW",886,41003697,New York City,nytimes,True,,46
2018/1/5,3:32,949121298977972224,18-year-old was charged with manslaughter in the death of a 65-year-old man who was punched in a Brooklyn subway st… https://t.co/btQzxEYoS7,886,41003697,New York City,nytimes,True,,135
2018/1/5,3:25,949119517359333376,"RT @NYTSports: ""I’m not where I personally want to be."" No Serena Williams at the Australian Open. https://t.co/mIXpN0h535",886,41003697,New York City,nytimes,True,,23
2018/1/5,3:2,949113743706935297,The new offshore oil and gas drilling would open more than a billion acres in the Arctic and along the Eastern Seab… https://t.co/Q0MIwnTJSP,886,41003697,New York City,nytimes,True,,284
2018/1/5,2:47,949109986604539904,"There are multiple claims for Charles Manson’s remains, his property or both. A California court will soon take up… https://t.co/FZUVcJXSSi",886,41003697,New York City,nytimes,True,,76
2018/1/5,2:32,949106195784192001,"RT @nathanielpopper: On the rise of Ripple. If this is a tulip fever, the fever has spread to chrysanthemums and poppies. https://t.co/kuDJ…",886,41003697,New York City,nytimes,True,,229
2018/1/5,2:17,949102404133416962,"Where pot entrepreneurs go when the banks just say no
https://t.co/I0ar0EdStA",886,41003697,New York City,nytimes,True,,121
2018/1/5,2:2,949098664194166785,Evening Briefing: Here's what you need to know at the end of the day https://t.co/xA5yaggEkg,886,41003697,New York City,nytimes,True,,53
2018/1/5,1:47,949094891866542080,"Baltimore teachers say schools are so cold that students have had to attend class in hats, coats and gloves https://t.co/rgsvs1HeN5",886,41003697,New York City,nytimes,True,,494
2018/1/5,1:36,949092099969855488,"RT @nytopinion: .@MichaelWolffNYC’s new book shows that President Trump has no executive function, no ability to process information or wei…",886,41003697,New York City,nytimes,True,,865
2018/1/5,1:26,949089586172579840,RT @nytmike: Our reporting shows how an aide to AG Jeff Sessions asked a Hill staffer four days before Comey was fired whether staffer had…,886,41003697,New York City,nytimes,True,,4014
2018/1/5,1:17,949087330131959808,Hackers can exploit 2 major security flaws in the chips that run most of the world’s computers. Here's what you can… https://t.co/bgUQkXBCyG,886,41003697,New York City,nytimes,True,,283
2018/1/5,1:2,949083545758322694,Former Gov. Brendan T. Byrne of New Jersey has died. He helped bring gambling to Atlantic City and ushered in the s… https://t.co/IBvzkFuoQb,886,41003697,New York City,nytimes,True,,85
2018/1/5,0:48,949080061877063682,Exclusive reporting on the Russia inquiry: President Trump ordered his lawyer to stop Jeff Sessions from recusing h… https://t.co/SahtkvL10m,886,41003697,New York City,nytimes,True,,2160
2018/1/5,0:42,949078528540147712,RT @nytmike: EXCLUSIVE: Mueller's Investigation reveals details of how Trump had WH counsel lobby Sessions not to recuse; how a WH lawyer t…,886,41003697,New York City,nytimes,True,,7906
2018/1/5,0:32,949075998598926339,Steve Bannon’s remarks about Trump and his family further alienated some of Bannon’s most important backers https://t.co/t3YQ0O5GiS,886,41003697,New York City,nytimes,True,,125
2018/1/5,0:17,949072225163980801,What to watch on a snow day https://t.co/6uxC98PeiU,886,41003697,New York City,nytimes,True,,48
2018/1/5,0:2,949068440932880386,"Those iguanas falling from the trees in Florida? They probably aren’t dead, just stunned by the cold. https://t.co/k0E8I0T2jQ",886,41003697,New York City,nytimes,True,,531
