date,time,id_str,text,user_friends_count,user_location,user_followers_count,user_screen_name,user_verified,coordinates,retweet_count
2018/1/20,20:10,954808275287138304,"New York marchers are empowered: ""I feel like the revolution is now"" https://t.co/xJhfzx9JZj",886,41003697,New York City,nytimes,True,,262
2018/1/20,20:0,954805747396890630,"RT @ESCochrane: Pelosi on the shutdown:
""We just came from the capitol where our Republican colleagues have shut down the government....
Th…",886,41003697,New York City,nytimes,True,,46
2018/1/20,19:49,954802977998626816,"Wearing a backward cap has never been a logical choice in tennis, but the style has persisted https://t.co/3bgbOnA03D",886,41003697,New York City,nytimes,True,,43
2018/1/20,19:39,954800497860468739,Read the full text of Aly Raisman's statement during the sentencing hearing of Larry Nassar https://t.co/cqWmAkFSIT… https://t.co/mQUR7t5LAs,886,41003697,New York City,nytimes,True,,75
2018/1/20,19:35,954799464350404608,"RT @ESCochrane: ""We're not tired, we're just getting started."" ""Happy anniversary, Mr. President."" Organizers speaking to kick off Washingt…",886,41003697,New York City,nytimes,True,,219
2018/1/20,19:23,954796497228484608,Patrick Meehan used thousands of dollars in taxpayer money to settle the complaint after a former aide accused him… https://t.co/oqAz31rlpx,886,41003697,New York City,nytimes,True,,460
2018/1/20,19:19,954795504323514369,"Breaking News: Patrick Meehan, a congressman on a panel that examines harassment charges in the House, used public… https://t.co/wxyjuB9AbP",886,41003697,New York City,nytimes,True,,2394
2018/1/20,19:7,954792416019664897,"In the dizzying news cycle of the Trump era, a shutdown crisis now may be long forgotten by November https://t.co/WVpM89Uwd9",886,41003697,New York City,nytimes,True,,75
2018/1/20,19:0,954790866593382401,"RT @ESCochrane: Nancy Pelosi, speaking to women's marchers in front of the Lincoln Memorial: ""Wouldn't you love to see this group serve in…",886,41003697,New York City,nytimes,True,,78
2018/1/20,18:52,954788649417297921,"Trump's remarks were broadcast to the Mall, the first time a president had addressed the annual March for Life on l… https://t.co/tfLv6kNMp9",886,41003697,New York City,nytimes,True,,83
2018/1/20,18:42,954786119178125313,"RT @johannabarr: “Everyone kept saying people are going to burn out; don’t highlight all the terrible things that are happening,” said Fati…",886,41003697,New York City,nytimes,True,,28
2018/1/20,18:32,954783604260966401,The Women’s March became a movement. What’s next? https://t.co/me9QvugZOi https://t.co/5NCOqqCd66,886,41003697,New York City,nytimes,True,,105
2018/1/20,18:22,954781184537579526,"RT @joumana_khatib: Watch scenes of the #WomensMarch2018 across the country: ""The only thing we have to lose is our chains"" https://t.co/tK…",886,41003697,New York City,nytimes,True,,223
2018/1/20,18:17,954779826669400065,New York lawmakers are trying to find options to sidestep the effects of President Trump’s new federal tax plan https://t.co/fnRnwUgco8,886,41003697,New York City,nytimes,True,,75
2018/1/20,18:2,954776055524528128,Read the full text of Aly Raisman's statement during the sentencing hearing of Larry Nassar https://t.co/xVYX23CyXf https://t.co/toiwsZ7cqd,886,41003697,New York City,nytimes,True,,261
2018/1/20,17:52,954773531425984513,"RT @jmartNYT: Why were most Dems willing to engage in brinksmanship? 

Because they know the midterms will revolve around Trump &gt;

https://…",886,41003697,New York City,nytimes,True,,47
2018/1/20,17:42,954771012377366530,"The government shutdown risks political peril for both parties, and lawmakers insist that they were eager for a res… https://t.co/kw2C5uZAj5",886,41003697,New York City,nytimes,True,,48
2018/1/20,17:32,954768524525916166,Trump accused Democrats of orchestrating a government shutdown to detract from the anniversary of his inauguration https://t.co/MssBkoxY1K,886,41003697,New York City,nytimes,True,,350
2018/1/20,17:17,954764744744931328,Opinion: Here's what women around the country have done with their pussy hats https://t.co/FighucP4br,886,41003697,New York City,nytimes,True,,103
2018/1/20,17:2,954760968516571136,"Women’s March rallies are taking place in hundreds of cities across the world, galvanized by the #MeToo moment. Her… https://t.co/IFDL5uQNnp",886,41003697,New York City,nytimes,True,,427
2018/1/20,16:32,954753410271760384,"Paul Bocuse, the chef who revolutionized French cuisine at his 3-Michelin star restaurant, has died at 91 https://t.co/pxtlvlSonv",886,41003697,New York City,nytimes,True,,291
2018/1/20,16:17,954749627546337280,The latest front in the partisan struggle over the investigation into the Russia inquiry? A 2016 application for a… https://t.co/F8Zyum8Kqd,886,41003697,New York City,nytimes,True,,60
2018/1/20,16:2,954745849057292288,"Yes, people really are eating Tide pods. No, It’s not safe. https://t.co/dq1jV7GRcE",886,41003697,New York City,nytimes,True,,305
2018/1/20,15:47,954742086980554752,We will be tracking Women's Marches around the world and talking with women about what’s brought them out and their… https://t.co/rTUwLOf2kJ,886,41003697,New York City,nytimes,True,,269
2018/1/20,15:32,954738314573242368,"Over cheeseburgers, Trump and Chuck Schumer struck an outline of an agreement to keep the government open. Then eve… https://t.co/lsqvIJZWoS",886,41003697,New York City,nytimes,True,,298
2018/1/20,15:17,954734524620877824,"10 breakout films of Sundances past, and where to stream them https://t.co/MoY5XjPsSd",886,41003697,New York City,nytimes,True,,77
2018/1/20,15:3,954731001938350081,"Heartier than chicken soup, this classic comfort dish is decidedly more stewlike https://t.co/hUdkydcK0F https://t.co/sa2DDhOuGH",886,41003697,New York City,nytimes,True,,63
2018/1/20,14:57,954729715838914560,Trump Passed a Cognitive Exam. What Does That Really Mean? https://t.co/cj4rP8dILy,886,41003697,New York City,nytimes,True,,105
2018/1/20,14:42,954725722513379328,"In Savannah, there is no shortage of history, beauty and architectural delights. And a visit needn’t cost you much. https://t.co/Oxr655YBgH",886,41003697,New York City,nytimes,True,,115
2018/1/20,14:28,954722213420204032,"Review: The Ghosts of Michael Brown, in ‘Until the Flood’ https://t.co/7R0zL5vMej",886,41003697,New York City,nytimes,True,,25
2018/1/20,14:22,954720683124195328,"The hidden gems of 2017 movies are on ... Netflix?
https://t.co/SsxdMkYLgP",886,41003697,New York City,nytimes,True,,94
2018/1/20,14:13,954718540459839488,"Yes, People Really Are Eating Tide Pods. No, It’s Not Safe. https://t.co/HeEYEGbJy2",886,41003697,New York City,nytimes,True,,340
2018/1/20,14:3,954715901168947200,Opinion: Anyone who doubts climate change should come to this island in Bangladesh https://t.co/lSDpuYBL0p,886,41003697,New York City,nytimes,True,,293
2018/1/20,13:42,954710623342022656,"The final Boeing 747 flight by any commercial U.S. airline took to the sky recently, with some tears and farewells.… https://t.co/byasX5k8Wj",886,41003697,New York City,nytimes,True,,154
2018/1/20,13:31,954708024647733249,"Women’s March Returns a Year Later, as Movement Evolves https://t.co/CaTjWF8xTi",886,41003697,New York City,nytimes,True,,295
2018/1/20,13:28,954707187078713344,"Paul Bocuse, Celebrated French Chef, Dies at 91 https://t.co/UaHdGhqQCy",886,41003697,New York City,nytimes,True,,308
2018/1/20,13:22,954705586729488384,How bad is this year's flu season? Is this particular strain dangerous? Answers to your questions about the flu. https://t.co/xmMuHkNTUO,886,41003697,New York City,nytimes,True,,155
2018/1/20,13:3,954700811623370752,Calls grow for Michigan State University president to resign over Larry Nassar case https://t.co/eMrkbtOa83,886,41003697,New York City,nytimes,True,,173
2018/1/20,12:42,954695521146494976,10 new books recommended by critics and editors at The New York Times https://t.co/ErX0lAk3Sw,886,41003697,New York City,nytimes,True,,214
2018/1/20,12:22,954690487990005760,RT @paula_span: Should you have a separate advance directive that tells your doctors what to do if you develop dementia?  https://t.co/V4TZ…,886,41003697,New York City,nytimes,True,,76
2018/1/20,12:3,954685711470551041,Here's how every senator voted on the government shutdown https://t.co/Xv97B6C5nr,886,41003697,New York City,nytimes,True,,607
2018/1/20,11:45,954681336530288640,"""Little Ripper"" helped save 2 swimmers at a beach in Australia. (Little Ripper is a drone.) https://t.co/VQ2cJWh8ET",886,41003697,New York City,nytimes,True,,128
2018/1/20,11:28,954677025373151232,"""They said, 'You look shaken,' and I said I was,"" Richard Durbin said. ""After you have been in politics as long I h… https://t.co/Cx2XimdDHH",886,41003697,New York City,nytimes,True,,476
2018/1/20,11:11,954672732783939584,Satellite imagery of the California mudslides that are being used to identify what caused them https://t.co/10o3qlCHx7,886,41003697,New York City,nytimes,True,,92
2018/1/20,10:53,954668173831344129,Fiction: Madeleine Thien’s New Novel of Communist Occupation Turns Inward https://t.co/7Q28FkgVuY,886,41003697,New York City,nytimes,True,,37
2018/1/20,10:49,954667269258440705,11 of Our Best Weekend Reads https://t.co/hRcyPAId3u,886,41003697,New York City,nytimes,True,,40
2018/1/20,10:37,954664060410310657,Olympic gymnasts Aly Raisman and Jordyn Wieber echoed dozens who say they too are victims of Larry Nassar https://t.co/VHdZcd27Yo,886,41003697,New York City,nytimes,True,,181
2018/1/20,10:18,954659450387918848,Meet Your Art Twin: A 400-Year-Old With an Oily Complexion https://t.co/rvE3qpQYa8,886,41003697,New York City,nytimes,True,,39
2018/1/20,10:3,954655519733682177,"For more than 600 years, Prague’s Astronomical Clock has measured the passing hours, noting when day turns to night… https://t.co/Zrc9brh9hM",886,41003697,New York City,nytimes,True,,334
2018/1/20,9:43,954650511759822849,"While the lives of squid are mysterious in many ways, one gruesome truth is that after mating comes death https://t.co/SufNiLX4kV",886,41003697,New York City,nytimes,True,,91
2018/1/20,9:27,954646441137508352,"Being antisocial leads to a longer life. For marmots.
https://t.co/DaLzio5lXK",886,41003697,New York City,nytimes,True,,245
2018/1/20,9:10,954642155976445952,"RT @nytvideo: She created a spreadsheet that enabled women in the media industry to name men accused of sexual misconduct. Now, she's speak…",886,41003697,New York City,nytimes,True,,38
2018/1/20,8:52,954637843690917889,"""The Bitcoin bubble may ultimately turn out to be a distraction from the true significance of the blockchain."" https://t.co/6ytFQB1bwE",886,41003697,New York City,nytimes,True,,128
2018/1/20,8:33,954633032505397248,"Playlist: The Playlist: Previously Unreleased Hendrix, and 10 More New Songs https://t.co/JXz0qZU4kE",886,41003697,New York City,nytimes,True,,156
2018/1/20,8:23,954630346502524928,A new book examines why child prodigies often do not sustain their genius into adulthood https://t.co/pGOmbRRCet,886,41003697,New York City,nytimes,True,,155
2018/1/20,8:5,954626010632327168,"A baby who had experimental surgery while still in the womb for a severe spinal defect, is born: full-term and kick… https://t.co/mE6EplU9IO",886,41003697,New York City,nytimes,True,,459
2018/1/20,7:48,954621644311494656,"“Dr. Nassar was not a doctor. He in fact is, was, and forever shall be a child molester, and a monster of a human b… https://t.co/qMj2PIGVRE",886,41003697,New York City,nytimes,True,,275
2018/1/20,7:32,954617507712851968,"RT @NYTStyles: He remembered thinking, “this guy has a lot of guts, and he’s kind of cute, too.” (And both, now active-duty Apache helicopt…",886,41003697,New York City,nytimes,True,,192
2018/1/20,7:20,954614482885578752,Senate Leaders Speak After Government Shuts Down https://t.co/YLdt83KR3b,886,41003697,New York City,nytimes,True,,84
2018/1/20,7:6,954611022869999616,"""How do you exorcise someone like this, get them out of your deepest being, out from under your skin?"" https://t.co/syUgYiQxsI",886,41003697,New York City,nytimes,True,,84
2018/1/20,6:47,954606173851930624,RT @NYTHealth: More young and middle-aged women are using A.D.H.D. drugs -- a lot more. https://t.co/HIcRS0X6Zi,886,41003697,New York City,nytimes,True,,56
2018/1/20,6:32,954602402950283266,Delta Air Lines said it was tightening its rules for service and support animals https://t.co/AKlQ1D1arM,886,41003697,New York City,nytimes,True,,119
2018/1/20,6:23,954600126512734209,RT @thomaskaplan: McConnell says the Senate will convene at noon on Saturday.,886,41003697,New York City,nytimes,True,,39
2018/1/20,6:18,954598891693002752,"Leaving a bad review on Airbnb is one thing, receiving one is another https://t.co/mpoMe1yJyi",886,41003697,New York City,nytimes,True,,44
2018/1/20,6:3,954595106383958016,"RT @shearm: My story on the day of negotiations between @SenSchumer and @realDonaldTrump, with @maggieNYT https://t.co/XmaW2DCeZq",886,41003697,New York City,nytimes,True,,55
2018/1/20,5:48,954591334421139456,A neighbor of Rand Paul is expected to plead guilty to a federal charge in connection with his attack of the senator https://t.co/57HM7jFD9H,886,41003697,New York City,nytimes,True,,61
2018/1/20,5:32,954587304164765696,"RT @nytpolitics: Over cheeseburgers, President Trump and Senator Schumer struck an outline of an agreement to keep the government open. The…",886,41003697,New York City,nytimes,True,,345
2018/1/20,5:18,954583787182219266,Here is the impact of the government shutdown on federal agencies https://t.co/rsI0Hzxg4M,886,41003697,New York City,nytimes,True,,492
2018/1/20,5:3,954580033452105728,Breaking News: The U.S. government has officially shut down. Lawmakers are now scrambling for a quick deal to reope… https://t.co/BazuiRbaEc,886,41003697,New York City,nytimes,True,,1738
2018/1/20,4:48,954576238659727360,RT @NeilMacFarquhar: H'o'w would you feel if your new alpha'b'et was suddenly full of apo'stro'phes in odd pla'c'es? #Kazakhstan https://t.…,886,41003697,New York City,nytimes,True,,12
2018/1/20,4:33,954572449110282240,"""Music is an inherently creative process. So we are directly opposing this feeling of loss with a feeling of creati… https://t.co/SlarusOduK",886,41003697,New York City,nytimes,True,,172
2018/1/20,4:18,954568693790445568,"When states make it harder to enroll, even eligible people drop Medicaid https://t.co/sK8XW1Qh4t",886,41003697,New York City,nytimes,True,,96
2018/1/20,4:8,954566171671646208,Here's how every senator voted on the government shutdown https://t.co/yr83pkdqKh,886,41003697,New York City,nytimes,True,,585
2018/1/20,3:48,954561142294278144,"RT @nytpolitics: If the government shuts down, hundreds of thousands of federal workers would be furloughed, affecting a wide range of gove…",886,41003697,New York City,nytimes,True,,115
2018/1/20,3:34,954557606907006976,A stopgap spending bill to keep the government open was blocked in the Senate. Latest updates here: https://t.co/H02W3crJsX,886,41003697,New York City,nytimes,True,,287
2018/1/20,3:24,954555096771198976,RT @nytgraphics: LIVE VOTE COUNT: The Senate is voting now to avert a government shutdown https://t.co/GV9koV4bU9,886,41003697,New York City,nytimes,True,,72
2018/1/20,3:16,954553275122114561,The Senate is holding a critical procedural vote to avert a government shutdown. Follow along here: https://t.co/vY5SerAmCy,886,41003697,New York City,nytimes,True,,194
2018/1/20,3:2,954549553948217344,RT @nytgraphics: The Senate is expected to vote tonight on a spending bill that would prevent a government shutdown. We’ll be counting the…,886,41003697,New York City,nytimes,True,,31
2018/1/20,2:48,954546032905457664,Calls grow for Michigan State University president to resign over Larry Nassar case https://t.co/1zE92uU0vk,886,41003697,New York City,nytimes,True,,219
2018/1/20,2:33,954542253640265734,RT @nytgraphics: What will happen if the government shuts down at midnight. Will you still get your mail tomorrow? https://t.co/LgCnnIZ82o,886,41003697,New York City,nytimes,True,,71
2018/1/20,2:18,954538492092182528,"The hidden gems of 2017 movies are on ... Netflix?
https://t.co/fUTTM5qe6Z",886,41003697,New York City,nytimes,True,,89
2018/1/20,2:3,954534719571492866,Evening Briefing: Here's what you need to know at the end of the day https://t.co/dYsGb3r9po,886,41003697,New York City,nytimes,True,,34
2018/1/20,1:48,954530932790382592,Opinion: Anyone who doubts climate change should come to this island in Bangladesh https://t.co/VLCuJxlSi3,886,41003697,New York City,nytimes,True,,292
2018/1/20,1:33,954527160500412416,"RT @jennymedina: In 81-pages, there's endless details about how the gunman spent the hours, days and months preparing the biggest mass shoo…",886,41003697,New York City,nytimes,True,,385
2018/1/20,1:18,954523386327298048,The Senate scheduled a vote for 10 p.m. on moving forward with a short-term spending bill that would avert a govern… https://t.co/FouNfnqMxZ,886,41003697,New York City,nytimes,True,,124
2018/1/20,1:3,954519595791958016,“We recognize this report may spark a further discussion on the opioid crisis and we feel that it is a healthy and… https://t.co/gkyNEq8k46,886,41003697,New York City,nytimes,True,,852
2018/1/20,0:52,954516838741872640,"RT @nytopinion: After my father passed away, I learned a lot more about who he really was https://t.co/5E5GMa4ts0",886,41003697,New York City,nytimes,True,,31
2018/1/20,0:38,954513330097541121,"Tom Petty died of an accidental drug overdose in October after mixing medications that included opioids, the Los An… https://t.co/aROh7jOpEh",886,41003697,New York City,nytimes,True,,1687
2018/1/20,0:30,954511498038169600,"RT @TheSteinLine: The Cavaliers are pursuing separate deala for DeAndre Jordan and George Hill in advance of the Feb. 8 trade deadline, acc…",886,41003697,New York City,nytimes,True,,1669
2018/1/20,0:18,954508305099083776,"The final Boeing 747 flight by any commercial U.S. airline took to the sky recently, with some tears and farewells.… https://t.co/fbTavQJ8Gg",886,41003697,New York City,nytimes,True,,87
2018/1/20,0:16,954507950332239872,"RT @thomaskaplan: McConnell schedules 10 p.m. cloture vote on the House-passed stopgap bill. As of now, at least, the vote seems likely to…",886,41003697,New York City,nytimes,True,,21
2018/1/20,0:6,954505275301662720,"Popular crime-prediction software is no better than untrained humans, study finds https://t.co/J7Tf1rvQbB",886,41003697,New York City,nytimes,True,,100
2018/1/19,23:53,954502016872562688,"Breaking News: Despite declaring Russia barred from the Winter Games, Olympic officials have cleared a path for hun… https://t.co/4iTluNGNCs",886,41003697,New York City,nytimes,True,,183
2018/1/19,23:48,954500749945393155,Evening Briefing: Here's what you need to know at the end of the day https://t.co/EW8bf6DnP7,886,41003697,New York City,nytimes,True,,49
2018/1/19,23:33,954496955106906113,Pope Francis broke with protocol and left his popemobile to comfort a policewoman who was thrown from her horse dur… https://t.co/RyXjbekThS,886,41003697,New York City,nytimes,True,,175
2018/1/19,23:18,954493186772172801,"Trump and Schumer end private talks with ""progress,’ but no deal. Latest updates: https://t.co/iKLZvvDceo",886,41003697,New York City,nytimes,True,,92
2018/1/19,23:3,954489437953712131,"Heartier than chicken soup, this classic comfort dish is decidedly more stewlike https://t.co/IsLYdy9ZUW https://t.co/j8eejitCgl",886,41003697,New York City,nytimes,True,,63
2018/1/19,22:48,954485633485066242,"RT @JulietMacur: Why is the United States Olympic Committee protecting USA Gymnastics? Whatever the reason, it’s time for it to stop.  http…",886,41003697,New York City,nytimes,True,,154
2018/1/19,22:32,954481606353408000,The model Harry Uzoka died shortly after being found injured from a stabbing. Another model and his friend were cha… https://t.co/FVQ5ZfQuXN,886,41003697,New York City,nytimes,True,,103
2018/1/19,22:16,954477618174349312,Facebook said it plans to prioritize high-quality news by allowing users to rank news sources they see as the most… https://t.co/R0Mf8KtkYW,886,41003697,New York City,nytimes,True,,165
2018/1/19,22:1,954473814418755584,"New York City’s MTA plans to spend close to $4 billion to buy hundreds of new subway trains, a major investment to… https://t.co/ocimSpqVQz",886,41003697,New York City,nytimes,True,,120
2018/1/19,21:46,954470030649053189,"For 30 years, black travelers navigating Jim Crow laws relied on “The Negro Motorist Green Book” to guide them safe… https://t.co/tBvQ7i9xT6",886,41003697,New York City,nytimes,True,,181
2018/1/19,21:31,954466273265676293,Journalists at The Los Angeles Times have overwhelmingly voted to form a union despite aggressive opposition from t… https://t.co/K371UMi4ke,886,41003697,New York City,nytimes,True,,274
2018/1/19,21:20,954463487568302081,A man who was arrested in December and charged with killing his mother and stepfather is now tied to 7 more killing… https://t.co/5Dp8YJKDS1,886,41003697,New York City,nytimes,True,,69
2018/1/19,21:10,954461012299829249,Read the preliminary report into the Las Vegas shooting https://t.co/JW5tdmOvxf,886,41003697,New York City,nytimes,True,,90
2018/1/19,21:0,954458464700559362,The Las Vegas police took the unusual step of releasing key details about the investigation into the shooting that… https://t.co/kysrkweBV2,886,41003697,New York City,nytimes,True,,94
2018/1/19,20:50,954455960088731648,Olympic gymnasts Aly Raisman and Jordyn Wieber echoed dozens who say they too are victims of Larry Nassar https://t.co/PsiLwAbKlf,886,41003697,New York City,nytimes,True,,247
2018/1/19,20:41,954453695307157505,"Senator Robert Menendez of New Jersey, a Democrat, will face a new trial on federal corruption charges. His initial… https://t.co/KyZ7Hexwar",886,41003697,New York City,nytimes,True,,89
2018/1/19,20:30,954451023036403712,One day your mind may fade. At least you’ll have a plan. https://t.co/MMMl38gu4T https://t.co/sRbMDlpEVU,886,41003697,New York City,nytimes,True,,61
2018/1/19,20:15,954447142826971136,"Trump’s vulgar comments may have horrified many Americans, but for Haitians in South Florida, it was nothing new https://t.co/MPaKLWNz9M",886,41003697,New York City,nytimes,True,,134
2018/1/19,20:0,954443504029196288,"Modern Love: ""There is a meditative quality to being on a bicycle. You must focus on the chaos that seems to envelo… https://t.co/SWSc4ghvbA",886,41003697,New York City,nytimes,True,,122
2018/1/19,19:45,954439580236894209,Jacinda Ardern will be the first leader of New Zealand to take parental leave https://t.co/wzWfX3774n,886,41003697,New York City,nytimes,True,,80
2018/1/19,19:30,954435818680184832,"A shadow financial aid system known as “merit aid” exists, which is a form of discounting that has little to do wit… https://t.co/gxfxAZVcA2",886,41003697,New York City,nytimes,True,,62
2018/1/19,19:15,954432046620962816,"The decision to hear the case came almost a year after the first travel ban, issued a week after Trump took office,… https://t.co/icIirXUlwB",886,41003697,New York City,nytimes,True,,74
2018/1/19,19:12,954431378535387136,"Breaking News: The Supreme Court will hear a challenge to President Trump’s latest travel ban, which puts limits on… https://t.co/sMqXZdk7du",886,41003697,New York City,nytimes,True,,318
2018/1/19,19:10,954430770382364673,"Senate Democrats appear ready to block any deal, gambling that Trump will have to offer concessions to avoid a shut… https://t.co/9S4yn66Rom",886,41003697,New York City,nytimes,True,,64
2018/1/19,18:55,954427017042300929,Trump's views on the border wall have shifted repeatedly since he raised the idea nearly 4 years ago https://t.co/d7wyY3SWCk,886,41003697,New York City,nytimes,True,,81
2018/1/19,18:40,954423272992624640,"“Dr. Nassar was not a doctor. He in fact is, was, and forever shall be a child molester, and a monster of a human b… https://t.co/gbgojH37mp",886,41003697,New York City,nytimes,True,,319
2018/1/19,18:25,954419459128741888,He traded a tortoise for a turtle. He got 6 months in jail. https://t.co/xGKAwfq4qe,886,41003697,New York City,nytimes,True,,45
2018/1/19,18:10,954415689321852928,"A look back at the events that lead to the brink of a government shutdown, with immigration and spending as the mai… https://t.co/3QJ82XYLoc",886,41003697,New York City,nytimes,True,,84
2018/1/19,17:55,954411925303123969,"Trump invited Senator Chuck Schumer, the Democratic leader, to the White House to reopen negotiations on a deal to… https://t.co/nrBvrfu3ib",886,41003697,New York City,nytimes,True,,143
2018/1/19,17:45,954409391578632192,"RT @nytvideo: What's next for Moira Donegan, the woman who created the spreadsheet of men in the media industry accused of sexual harassmen…",886,41003697,New York City,nytimes,True,,28
2018/1/19,17:35,954406908567441408,"Asking about citizenship could make the census less accurate, some fear. Here's why. https://t.co/eqKgWcSh2r",886,41003697,New York City,nytimes,True,,74
2018/1/19,17:20,954403127939207168,"Bill de Blasio eased his opposition to congestion pricing for Manhattan drivers, calling a Cuomo proposal “a step i… https://t.co/vnEEJTmbtb",886,41003697,New York City,nytimes,True,,49
2018/1/19,17:6,954399568803909634,RT @monicadavey1: Midwesterners must see this: The view from the Great Lakes as ships try to get through the ice and beat the season's dead…,886,41003697,New York City,nytimes,True,,46
2018/1/19,16:55,954396836089024513,"Senate Democrats appear ready to block legislation to keep the government funded past midnight, gambling that Trump… https://t.co/6uRZ0CckLb",886,41003697,New York City,nytimes,True,,98
